<phpunuhi
        xmlns:xsi="http://www.w3.org/2001/XMLSchema-instance"
        xsi:noNamespaceSchemaLocation="phpunuhi.xsd"
>

    <php>
        <env name="DB_HOST" value="127.0.0.1"/>
        <env name="DB_PORT" value="3306"/>
        <env name="DB_USER" value=""/>
        <env name="DB_PASSWD" value=""/>
        <env name="DB_DBNAME" value=""/>
    </php>

    <translations>

        <set name="json">
            <format>
                <json indent="2" sort="true"/>
            </format>
            <locales>
                <locale name="de">./snippets/storefront/de.json</locale>
                <locale name="en">./snippets/storefront/en.json</locale>
            </locales>
        </set>

        <set name="ini">
            <format>
                <ini sort="true"/>
            </format>
            <locales>
                <locale name="de" iniSection="de">./snippets/storefront/de.json</locale>
                <locale name="en" iniSection="en">./snippets/storefront/en.json</locale>
            </locales>
        </set>

        <set name="php">
            <format>
                <php indent="2" sort="true"/>
            </format>
            <locales>
                <locale name="de">./snippets/storefront/de.php</locale>
                <locale name="en">./snippets/storefront/en.php</locale>
            </locales>
        </set>

        <set name="shopware6">
            <format>
                <shopware6 entity="product"/>
            </format>
            <filter>
                <include>
                    <key>abc</key>
                </include>
                <exclude>
                    <key>abc</key>
                </exclude>
            </filter>
            <locales>
                <locale name="de"/>
                <locale name="en"/>
            </locales>
        </set>

    </translations>

</phpunuhi>
